Falco: Rock Me Amadeus (English Version),1
Maroon 5: Harder To Breathe,6
"Ronstadt, Linda: Blue Bayou",2
Nena: 99 Luftballons (German Version),2
"Hamilton, Joe Frank And Reynolds: Fallin' In Love",1
Madonna: Vogue,1
"Michael, George: Father Figure",1
"Sinatra, Frank: Luck Be A Lady",1
Fergie: London Bridge,6
"Jett, Joan: I Hate Myself For Lovong You",1
Cake: Short Skirt Long Jacket,6
"Commodores, The: Brick House",1
Butthole Surfers: Pepper,1
Hot Chocolate: You Sexy Thing,1
"Smith, Will: Wild Wild West",1
"Bolton, Michael: Said I Loved You, But I Lied",1
"Monae, Janelle: Tightrope",2
"Muppets, The: Jason Siegel & Gary-Man Or Muppet",3
"Muppets, The: Movin' Right Along",3
"Smith, Will: Men In Black",2
"Rimes, LeAnn: Can't Fight The Moonlight (G Stack Mix)",1
Beastie Boys: Get It Together,1
Backstreet Boys: Everybody (Backstreet's Back),1
Oakenfold: Faster Kill Pussycat (Feat. Brittany Murphy),1
"Denver, John: Take Me Home Country Roads",1
"America: Last Unicorn, The",1
Genesis: Thats All,2
Cake: Sheep Go To Heaven,1
"Temptations, The: Ain't Too Proud To Beg",1
"Bowie, David: As The World Falls Down",2
Depeche Mode: Policy Of Truth,1
TLC: Silly Ho,2
Berlin: Metro,1
"Harris, Calvin: Sweet Nothing",1
Black Sabbath: Iron Man,1
"Idol, Billy: Cradle Of Love",1
Aerosmith: Crazy,2
DJ Jazzy Jeff & The Fresh Prince: Summertime,1
Eagle Eye Cherry: Save Tonight,1
Lady Gaga: Marry The Night,1
Audioslave: Be Yourself,1
Queen: I Want To Break Free,2
"Black Keys, The: Little Black Submarines",3
Queen: Play The Game,1
"Crow, Sheryl: Everyday Is A Winding Road",1
Wilson Phillips: Hold On,6
"Beatles, The: When I'm Sixty Four",3
Elmo & Patsy: Grandma Got Run Over By A Reindeer,2
AC-DC: Thunderstruck,2
"Mraz, Jason: I'm Yours (2)",1
Thrice: Red Sky,1
"Mann, Barry: Who Put The Bomp",1
Primitive Radio Gods: Standing Outside A Broken Phone Booth With Money In My Hand,2
Creedence Clearwater Revival: I Put A Spell On You,1
TLC: Waterfalls,1
Cornershop: Brimful Of Asha,1
"Rae, Corinne Bailey: I'd Like To",1
Madonna: Hanky Panky,1
Garbage: Queer,1
Garbage: Stupid Girl,1
L.F.O.: Girl On T.V.,1
"Humperdinck, Engelbert: Spanish Eyes",1
"Sinatra, Frank: Fly Me To The Moon (Uptempo Version)",2
Limp Bizkit: Faith,1
Black Eyes Peas: I Gotta Feelin,1
: Tom_Jones_-_Sex_Bomb_-_MF05806-1572.ZIP,1
"Whitesnake: Deeper The Love, The",1
"Bloodhound Gang, The: Fire Water Burn",3
"Gray, David: One I Love, The",1
Feist: 1234,1
Foreigner: I Want To Know What Love Is,2
"Medley, Bill: Time Of My Life (I've Had) (Feat. Jennifer Warnes)",2
"Spektor, Regina: Fidelity",1
Fleetwood Mac: Dreams,4
: The_Beatles_-_Dear_Prudence_-_SFDT-2732.ZIP,1
Marina & The Diamonds: (I Am Not A) Robot,1
"Iglesias, Enrique: Tonight",1
Marina & The Diamonds: Primadonna,1
Filter: Take A Picture,1
Goo Goo Dolls: Slide,1
"Morissette, Alanis: You Learn",1
Young MC: Bust A Move,3
"Perry, Katy: Firework",2
"Twain, Shania: I'm Gonna Getcha Good",1
Madonna: Express Yourself,3
Shakira: Objection (Tango),2
R. Kelly: Motivation (Remix) (Feat. Kelly Rowland),2
"Swift, Taylor: Mean",1
"Loeb, Lisa: I Do",1
: Karmin-Brokenhearted-SB25589.zip,2
"Keys, Alicia: No One",3
Xscape: Who Can I Run To,2
Cher: Shoop Shoop Song (It's In His Kiss),1
"Ronson, Mark: Valerie (Feat. Amy Winehouse)",8
"Yearwood, Trisha: That's What I Like About You",2
Robyn: Show Me Love,2
Dixie Chicks: Long Time Gone,1
Brandy: Almost Doesn't Count,1
Genesis: Keep It Dark,1
: Red_Hot_Chili_Peppers_-_Suck_My_Kiss_-_MW883-10.ZIP,1
"Allen, Lily: Not Fair",1
Alice In Chains: No Excuses,1
Nirvana: Come As You Are,1
"Raconteurs, The: Steady, As She Goes",1
Rihanna: S&M,3
Bowling For Soup: Girl All The Bad Guys Want,1
"Perry, Katy: Waking Up In Vegas",3
B.O.B.: Magic (Feat. Rivers Cuomo),2
Chumbawamba: Tub Thumpin',1
Maroon 5: This Love,1
Better Than Ezra: Desperately Wanting,1
Band Aid: Do They Know It's Christmas,1
"John, Elton: Crocodile Rock",1
"Lavigne, Avril: Sk8er Boi",2
"Coulton, Jonathan: I Feel Fantastic",1
Arcade Fire: City With No Children,1
"Coulton, Jonathan: Shop Vac",1
"McLean, Don: Vincent (Starry Starry Night)",1
Children's Songs: Alphabet Song,1
Flogging Molly: What's Left Of The Flag,3
Simple Plan: I'd Do Anything,2
: Rent-Another_Day-PS08148.zip,1
Cheap Trick: Surrender,2
Culture Club: Karma Chameleon,1
"Yankovic, 'Weird' Al: Pentiums",1
Traditional: O Canada,2
"Flaming Lips, The: Fight Test",1
"Kroeger, Chad: Hero",2
Team America: Montage,1
R.E.M.: Its The End Of The World As We Know It (And I Feel Fine),4
"Coulton, Jonathan: Curl",1
"Counting Crows: Long December, A",1
"Coulton, Jonathan: Christmas Is Interesting",1
Blink-182: I Miss You,1
Starship: We Built This City,1
Shinedown: .45,1
Smash Mouth: All Star,2
: Weird_Al_Yankovic_-_Canadian_Idiot__-_ZKG3714.ZIP,1
Linkin Park: Numb,1
Pink: Just Give Me A Reason,1
"Clash, The: I Fought The Law",1
: The_All_American_Rejects_Swing_Swing_135615.zip,1
Ke$ha: Die Young,1
Vampire Weekend: Diane Young,2
"Timberlake, Justin: Like I Love You",1
Foo Fighters: Best Of You,2
Pearl Jam: Rearviewmirror,2
Led Zeppelin: Going To California,2
"Beatles, The: Taxman",1
Nine Inch Nails: We`re In This Together (Acoustic),1
Florence & The Machine: Dog Days Are Over,10
Rihanna: Shut Up & Drive,1
"Hot Hot Heat: Talk To Me, Dance With Me",1
"Thicke, Robin: Blurred Lines",2
"White Stripes, The: Fell In Love With A Girl",4
"Loggins, Kenny: I'm Alright",1
Red Hot Chili Peppers: Suck My Kiss,4
: 01.-Martin-Solveig-Feat.-Dragonette-Hello-(SF301V-10).zip,1
OutKast: BOB (Bombs Over Baghdad),6
Goldfrapp: Ooh La La,2
: Pink_-_F--king_Perfect_(Explicit)_-_G24260.ZIP,2
"Calloway, Cab: Minnie The Moocher",10
"Berry, Chuck: My Ding-A-Ling",1
Rush: Closer To The Heart,2
Styx: Blue Collar Man (Long Nights),1
"Judas Priest: Hellion-Electric Eye, The",3
Of Monsters & Men: Mountain Sound,1
Black Sabbath: Heaven & Hell,1
Cherry Poppin' Daddies: Zoot Suit Riot,3
Queensryche: Empire,1
Iron Maiden: Aces High,2
Timbuk 3: Futures So Bright (I Gotta Wear Shades),1
"Sinatra, Frank: Someone To Watch Over Me",2
"Ford, Lita: Kiss Me Deadly",3
Mickey & Sylvia: Love Is Strange,1
"Ford, Lita: Close My Eyes Forever (Feat. Ozzy Osbourne)",6
"Rolling Stones, The: Jumpin' Jack Flash",1
Fuel: Shimmer,1
Foo Fighters: DOA,1
Sublime: What I Got,10
"Badu, Erykah: Tyrone",3
"Knight, Gladys & The Pips: If I Were Your Woman",1
"Scaggs, Boz: Look What You've Done To Me",1
"Cash, Johnny: Boy Named Sue, A",1
"Gray, Dobie: Drift Away",3
Stray Cats: Stray Cat Strut,3
"Rivers, Johnny: Secret Agent Man",1
"Dirty Heads, The: Lay Me Down",3
"Verve, The: Bitter Sweet Symphony",1
"Parton, Dolly: Jolene",7
"Supremes, The: Stop! In The Name Of Love",1
Pearl Jam: Hail Hail,1
Soft Cell: Say Hello Wave Goodbye,1
"Hendrix, Jimi: All Along The Watchtower",2
Justice: D.A.N.C.E,1
Beastie Boys: Intergalactic,2
Meat Loaf: Bat Out Of Hell,1
Bloc Party: Like Eating Glass,1
"Motels, The: Suddenly Last Summer",1
Tears For Fears: Change,1
"Young, Paul: Love Of The Common People",1
"Cars, The: Moving In Stereo",3
Dire Straits: Romeo & Juliet,1
"Beat, The: Too Nice To Talk To",1
"Collins, Edwyn: Girl Like You, A",2
"Blow Monkeys, The: Digging Your Scene",1
"Holt, John: Tide Is High, The",1
"Palmer, Robert: Johnny & Mary",1
"English Beat, The: Too Nice To Talk To",2
"Police, The: Every Little Thing She Does Is Magic",2
"Four Seasons, The: Beggin'",1
"Polecats, The: Make A Circuit With Me",1
"White, Barry: Never Never Gonna Give Ya Up",1
Hot Chocolate: Emma,1
"Style Council, The: My Ever Changing Moods",1
"Kinks, The: Superman, (Wish I Could Fly Like)",1
"Replacements, The: I'll Be You",1
: Electric Light Orchestra - Last Train To London.zip,1
Prince: U Got The Look (Feat. Sheena Easton),2
Flesh For Lulu: I Go Crazy,4
: David_Bowie_Look_Back_In_Anger_159715.zip,1
"Jones, Tom: (Theme From) Thunderball",1
Radiohead: Nude,4
Muse: New Born,1
Jimmy Eat World: Sweetness,5
Radiohead: Paranoid Android,1
Journey: Faithfully,2
"Jackson, Michael: Black Or White (Feat. Rapper)",1
"Smith, Will: Gettin' Jiggy Wit It",1
"Kamakawiwo'ole, Israel: Over The Rainbow",2
"John, Elton: Something About The Way You Look Tonight",1
: Drake_-_Headlines_(Explicit)_-_G24915.ZIP,1
Drake: Find Your Love,5
Ne-Yo: Closer,2
Maroon 5: Through With You,2
Santogold: L.E.S. Artistes,2
Ginuwine: In Those Jeans,2
Jay-Z: No Church In The Wild (Feat. Kanye West & Frank Ocean),5
"Ocean, Frank: Pyramid",3
Doves: Kingdom Of Rust,2
"Thomas, Carl: I Wish",1
"Jackson, Michael: Leave Me Alone",2
: Imagine Dragons - Radioactive.zip,2
": West, Kanye - Mercy (Feat. Big Sean, Pusha T & 2 Chainz).zip",1
"Ocean, Frank: Thinkin' Bout You",3
"Lumineers, The: Ho Hey",1
Grouplove: Tongue Tied,1
"Ocean, Frank: We All Try",1
TLC: Creep,1
: John_Legend_Feat._Ludacris_-_Tonight_(Best_You_Ever_Had)_-_G27077.ZIP,1
: Justin_Timberlake_feat._Jay_Z_-_Suit_and_Tie_(explicit)_-_G27399.ZIP,2
": Blake, James - Retrograde.zip",2
Muse: Panic Station,1
: Kendrick_Lamar_-_Bitch%2C_Don't_Kill_My_Vibe_(explicit)_-_G27504.ZIP,2
"David, Craig: Fill Me In",1
: pusher love girl.zip,3
Die Antwoord: Enter The Ninja (Male Solo),1
Miguel: How Many Drinks,1
"Lamar, Kendrick: B-tch, Don't Kill My Vibe",1
"West, Kanye: New Slaves",1
"Timberlake, Justin: Pusher Love Girl",2
Fitz & The Tantrums: Out Of My League,2
"Presley, Elvis: It's Now Or Never",1
Flo Rida: Low (Feat. T-Pain),4
"Rolling Stones, The: Beast Of Burden",1
"Caldwell, Bobby: What You Won't Do For Love",1
Deep Purple: Space Truckin',1
Evanescence: Bring Me To Life,6
"Pussycat Dolls, The: Buttons (Feat. Snoop Dogg)",1
Broadway-Musicals: Chicago-When You`re Good To Mama,1
K's Choice: Not An Addict,2
"McEntire, Reba: Fancy",1
Dexy's Midnight Runners: Come On Eileen,2
Sum 41: Fat Lip,1
"Lewis, Jerry Lee: Whole Lotta Shakin' Goin' On",1
Scissor Sisters: I Don't Feel Like Dancin',1
: V_V_Brown_Shark_In_The_Water_79443.zip,3
New Politics: Yeah Yeah Yeah,1
Adele: Cold Shoulder,1
Aerosmith: Jaded,2
: Pearl_Jam_-_The_Fixer_-_MW917-12.ZIP,1
Beyonce: Sweet Dreams,1
"Cher: Gypsies, Tramps And Thieves",1
"Carpenters, The: Rainy Days And Mondays",1
"Zappa, Frank: Dirty Love",2
Fannypack: Camel Toe,1
Pet Shop Boys: West End Girls,1
Cracker: Low,2
Poison: Talk Dirty To Me,2
Queen: Bohemian Rhapsody,15
"Shannon, Del: Runaway",1
Magazine: Shot By Both Sides,1
Echo & The Bunnymen: Bedbugs And Ballyhoo,1
: Len - Steal_My_Sunshine - PS09446.zip,1
"Morrissey: Irish Blood, English Heart",1
Lady GaGa: Paparazzi,5
"Rimes, LeAnn: But I Do Love You",1
Eminem: Love The Way You Lie (Feat. Rihanna),1
Pearl Jam: Animal,1
Beck: Sexx Laws,12
Blondie: Hanging On The Telephone,1
"Jett, Joan: Cherry Bomb",3
"Owens, Buck: Act Naturally",2
"Thin Lizzy: Rocker, The",1
"Clapton, Eric: Lay Down Sally",8
"Pop, Iggy: Real Wild Child",1
Tenacious D: Kickapoo,2
"Rolling Stones, The: Dead Flowers",4
Weezer: Pork And Beans,2
"Ramones, The: KKK Took My Baby Away, The",2
"Nelson, Willie: Whiskey River",1
"Pickett, Wilson: In The Midnight Hour",10
"Gaye, Marvin: What's Going On",1
"Four Tops: Baby, I Need Your Lovin'",8
"Mars Volta, The: Widow, The",3
"Cohen, Leonard: Hallelujah",2
"Pickett, Wilson: 634-5789 (Soulsville, U.S.A)",5
"Thin Lizzy: Boys Are Back In Town, The",1
Loggins & Messina: Your Mama Don't Dance,1
"Four Tops: I Can't Help Myself (Sugar Pie, Honey Bunch)",1
": Zevon, Warren - Excitable Boy.zip",1
"Crosby, Stills, & Nash: Long Time Gone",1
Klymaxx: Meeting In The Ladies Room,2
Pink Floyd: Not Now John,2
Led Zeppelin: What Is And What Should Never Be,1
"Prima, Louis: I Wanna Be Like You (From The Jungke Book)",1
Ke$ha: We R Who We R,2
"Bloodhound Gang, The: Ballad Of Chasey Lane",3
Led Zeppelin: Dancing Days,1
Blink-182: All The Small Things,2
"Stooges, The: Gimme Danger",1
Cutting Crew: (I Just) Died In Your Arms,3
Metallica: Master Of Puppets,1
Brian Setzer Orchestra: This Cat's On A Hot Tin Roof,2
: The Stooges- Loose.zip,2
: Kiss - I Stole Your Love.zip,1
Squirrel Nut Zippers: Suits Are Picking Up The Bills,1
: Mary_Poppins_-_Chim_Chim_Cheree_-_G04285.ZIP,1
"Denver, John: Thank God I'm A Country Boy",1
"Taylor, James: Fire And Rain",1
: The_Smiths_Please_Please_Please_Let_Me_Get_What_I_Want.zip,1
"Wilson, Jackie: Your Love Keeps Lifting Me Higher And Higher",1
"Monkees, The: Pleasant Valley Sunday",1
"Stooges, The: Search & Destroy",3
Ben Folds Five: Battle Of Who Could Care Less,1
"Bangles, The: In Your Room",1
Belly: Feed The Tree,2
Talking Heads: Wild Wild Life,1
"Zevon, Warren: Werewolves Of London",1
Afroman: Because I Got High,3
Rihanna: Only Girl (In The World),1
Van Halen: Everybody Wants Some!!,1
Soundgarden: Black Hole Sun,2
"Nelson, Willie: Always On My Mind",3
"Roth, David Lee: California Girls",1
"Diamond, Neil: Forever In Blue Jeans",3
U2: I Still Haven't Found What I'm Looking For,1
Kasabian: Fire,1
ABBA: S. O. S.,1
U2: Stay Forever Close,2
India.Arie: Video,1
: Destiny's_Child_-_Emotion_-_G10736.ZIP,1
Gin Blossoms: Found Out About You,1
Young The Giant: Cough Syrup,1
Goo Goo Dolls: Iris,4
"Kinks, The: Sunny Afternoon",1
Reel Big Fish: Beer,1
"Idol, Billy: Dancing With Myself",1
"Cheese, Richard: Creep",2
Depeche Mode: Enjoy The Silence,1
Arcade Fire: Wake Up,2
Everclear: Father Of Mine,1
"Marley, Bob: Three Little Birds",1
"Greenwood, Lee: God Bless The U.S.A.",1
Journey: Open Arms,3
Phoenix: 1901,3
"Pickett, Bobby Boris & The Crypt Kickers: Pickett, Bobby Boris & The Crypt Kickers",1
MGMT: Kids,2
"OutKast: So Fresh, So Clean",1
"Marley, Damian Jr. Gong: Welcome To Jamrock",1
"Springsteen, Bruce: Glory Days",1
Robin S.: Show Me Love,1
LL Cool J: Mama Said Knock You Out,1
Eurythmics: Sweet Dreams (Are Made Of This),1
Prince: Purple Rain,1
"Owens, Buck: Excuse Me (I Think I've Got A Heartache)",1
Led Zeppelin: Heartbreaker,1
Taking Back Sunday: Set Phasers To Stun,1
"Ace Of Base: Sign, The",2
: Keith_Sweat_Featuring_Athena_Cage_-_Nobody_-_G05756.ZIP,2
H-Town: Knockin' Da Boots,1
"Manchester, Melissa: Don't Cry Out Loud",1
"Joel, Billy: Vienna",1
"Strait, George: Amarillo By Morning",1
"John, Elton: Lucy In The Sky With Diamonds",1
Seven Mary Three: Cumbersome,1
Talking Heads: Take Me To The River,2
Boyz II Men: End Of The Road,3
"Haggard, Merle: Pancho And Lefty (Feat. Willie Nelson)",2
LL Cool J: I Need Love,2
"White Stripes, The: Denial Twist, The",1
"Timberlake, Justin: Rock Your Body",2
"Vannett, Connie: Pussycat Song, The",4
"Archies, The: Sugar, Sugar",1
"Kershaw, Sammy: Third Rate Romance",1
Frente: Accidentally Kelly Street,1
Lady GaGa: Just Dance (Feat. Colby O'Donis) (2),1
Falco: Der Kommissar (German),2
"Grant, Eddy: Electric Avenue",1
Ludacris: My Chick Bad (Feat. Nicki Minaj),1
T.I.: Dead And Gone (Feat. Justin Timberlake),1
: Akon_Ft._Snoop_Dogg_-_I_Wanna_Love_&_F--k_You_-_G15037.ZIP,1
"Cheese, Richard: Baby Got Back",2
Ludacris: Stand Up (Feat. Shawman),1
"Allman Brothers, The: Whipping Post",1
Creedence Clearwater Revival: Long As I Can See The Light,1
"Bloodhound Gang, The: Lap Dance Is So Much Better When The Stripper Is Crying, A",7
Marilyn Manson: Sweet Dreams (Are Made Of This),2
Alice In Chains: Would,1
"Gore, Lesley: You Don't Own Me",2
": Apple, Fiona - Sleep To Dream.zip",1
: Hedwig & The Angry Inch - Wig In A Box.zip,1
Ministry: Every Day Is Halloween,1
Space: Female Of The Species,1
Nine Inch Nails: Sin,6
Beastie Boys: She's Crafty,1
Panic At The Disco: I Write Sins Not Tragedies,1
Pink: Please Don't Leave Me,1
Salt-N-Pepa: Push It,1
They Might Be Giants: Ana Ng,2
"Joel, Billy: Only The Good Die Young",3
Talking Heads: And She Was,3
"Pop, Iggy: Candy (Feat. Kate Pierson)",5
Broadway-Musicals: Rent-Take Me Or Leave Me,4
"Floyd, King: Groove Me",2
Lemonheads: Mrs. Robinson,2
Ready For The World: Oh Sheila,2
"Martin, Ricky: Livin' La Vida Loca (English)",4
Berlin: Sex (I'm A...) (Duet Version),3
"Costello, Elvis: Radio, Radio",4
"Hendrix, Jimi: Fire",12
Brian Setzer Orchestra: Jump Jive And Wail,6
"Nelson, Willie: Mamas Don't Let Your Babies Grow Up To Be Cowboys (Feat. Waylon Jennings)",1
"Brown, Bobby: My Prerogative",1
"Lidell, Jamie: Multiply",1
White Zombie: More Human Than Human,1
"Kamoze, Ini: Here Comes The Hotstepper",8
"Specials, The: Nite Klub",2
Lil' Jon & The East Side Boyz: Get Low (Feat. The Ying Yang Twins),4
Stray Cats: Rock This Town,9
"Franklin, Aretha: Natural Woman (You Make Me Feel Like A)",4
Lil Jon: Get Low,1
Spice Girls: Spice Up Your Life,4
Creedence Clearwater Revival: Fortunate Son,2
Green Day: American Idiot,1
Run-DMC: Christmas In Hollis,1
Big Bad Voodoo Daddy: Mambo Swing,4
"Petty, Tom: Runnin' Down A Dream",1
"Cocker, Joe: You Are So Beautiful",1
"Aguilera, Christina: Lady Marmalade (Feat. Pink, Mya & Lil' Kim)",1
Living Color: Cult Of Personality,3
"Rush: Spirit Of Radio, The",2
"Scandal: Warrior, The",1
"Amos, Tori: God",1
UB40: Here I Am,1
Bad Company: Rock Steady,1
Rush: Subdivisions,2
"Boone, Debby: You Light Up My Life",2
"Petty, Tom: Stop Draggin My Heart Around (Feat. Stevie Nicks)",1
Marillion: Lavender,1
Green Day: Wake Me Up When September Ends,1
"Girls Aloud: Sexy, No No No",1
Massive Attack: Unfinished Sympathy,1
Nine Inch Nails: Burn (Acoustic),2
Stone Temple Pilots: Wicked Garden,3
Babes In Toyland: Sweet '69,4
Ambrosia: Biggest Part Of Me,2
Fatboy Slim: Rockefeller Skank,1
Foo Fighters: All My Life,3
"Bee Gees, The: Night Fever",3
Def Leppard: Hysteria,2
Nine Inch Nails: Wish,4
Queens Of The Stone Age: You Think I Ain't Worth A Dollar But I Feel Like A Millionaire,2
"Franklin, Aretha: Rock Steady",2
Broadway-Musicals: Phantom Of The Opera (Dance Remix),1
Def Leppard: Rock Of Ages,1
Def Leppard: Rocket,1
Stone Roses: Love Spreads,2
Cibo Matto: Si-Fi Wasabi,2
"Nine Inch Nails: Hand That Feeds, The",1
"May, Imelda: Mayhem",2
"Freberg, Stan: Nuttin' For Christmas",1
Accept: Fast As A Shark,1
"Estefan, Gloria: Rhythm Is Gonna Get You",1
"Pretenders, The: My City Was Gone",1
Madonna: Into The Groove,1
"Stevens, Cat: Father & Son",1
"Cross, Christopher: Sailing",1
Culture Club: Ill Tumble 4 Ya,1
"Iron Maiden: Number Of The Beast, The",1
Foo Fighters: Times Like These,3
"Buckley, Jeff: Eternal Life",1
Steely Dan: FM (No Static At All),1
Ministry: Jesus Built My Hotrod,2
Genesis: Mama,1
Queen: Save Me,1
"Squier, Billy: In The Dark",1
"Pointer Sisters, The: I'm So Excited",1
"Foundations, The: Build Me Up Buttercup",2
: Rihanna_We_Found_Love_123317.zip,1
"Twain, Shania: Honey I'm Home",1
Selena: I Could Fall In Love,1
"Go-Go's, The: Vacation",1
Lynyrd Skynyrd: Sweet Home Alabama,2
"Reed, Lou: Walk On The Wild Side",1
Fun: Carry On,1
"Joplin, Janis: Me & Bobby McGee",2
Queen: Fat Bottom Girls,3
"Henley, Don: Boys Of Summer, The",2
"Black Keys, The: Next Girl",2
"Lavigne, Avril: Girlfriend",1
"Imbruglia, Natalie: Torn",2
"Doors, The: Light My Fire",2
"Broadway-Musicals: Disney-Lion King, The-Hakuna Matata",1
Cheap Trick: Ain't That A Shame (Live Version),1
"John, Elton: Don't Go Breaking My Heart (Feat. Kiki Dee)",1
Autograph: Turn Up The Radio,1
Motley Crue: Wild Side,2
"Ramones, The: Beat On The Brat",1
"Aznavour, Charles: For Me, Formidable",1
Metallica: Nothing Else Matters,1
"Train: Hey, Soul Sister",2
"Morgan, Craig: Redneck Yacht Club",1
"McCoy, Travis: Billionaire (Feat. Bruno Mars)",1
: Champs-Tequila-SB04107.zip,1
: Alicia_Keys_Empire_State_Of_Mind_(Part_II)_Broken_Down_64205.zip,1
"Presidents Of The United States Of America, The: Peaches",2
Broadway-Musicals: Rent-Out Tonight,4
"Perry, Katy: Peacock",2
Creedence Clearwater Revival: Proud Mary,1
"Cash, Johnny: I Walk The Line",1
"Ian, Janis: At Seventeen",1
"Twain, Shania: You've Got A Way",1
"Houston, Whitney: Saving All My Love For You",1
"Gayle, Crystal: Talking In Your Sleep",1
Sisqo: Thong Song,1
Metric: Black Sheep,4
"Buble, Michael: Feeling Good",18
": Psjt183-12 - Bennett, Tony - Maybe This Time.zip",10
"Jimmy Eat World: Middle, The",9
"Hendrix, Jimi: Red House",1
"Jackson, Alan: Chattahoochee",2
"Pogues, The: Dirty Old Town",1
"Bowie, David: Port Of Amsterdam",2
"Joel, Billy: Just The Way You Are",1
"Cole, Natalie: Route 66",1
Three Dog Night: Joy To The World,1
"Fray, The: How To Save A Life",1
Love & Rockets: So Alive,1
Blue Swede: Hooked On A Feeling,1
Fleetwood Mac: Silver Springs,1
"Redding, Otis: (Sittin' On The) Dock Of The Bay",3
Guns 'N' Roses: November Rain,3
"McEntire, Reba: I'll Be",1
Fleetwood Mac: You Make Lovin' Fun,1
: The_White_Stripes_-_I_Just_Don't_Know_What_To_Do_With_Myself_-_SFDT-1427.ZIP,1
"Pretenders, The: I'll Stand By You",2
"Carter, Deana: Strawberry Wine",1
"Streets, The: Fit But You Know It",2
Monster Magnet: Space Lord,1
Lynyrd Skynyrd: Simple Man,2
Iron Maiden: 2 Minutes To Midnight,1
"Who, The: Behind Blue Eyes",2
"Presidents Of The United States Of America, The: Lump",1
Gnarls Barkley: Crazy,1
"Timberlake, Justin: Cry Me A River",1
"West, Kanye: All Falls Down (Feat. Syleena Johnson)",2
"Bowie, David: Five Years",1
: Cee Lo Green - Fuck You - DJFN.zip,2
"Police, The: Every Breath You Take",1
"Cardigans, The: Lovefool",1
"Statler Brothers, The: Flowers On The Wall",1
Beyonce: Crazy In Love (Feat. Jay-Z),1
"Furtado, Nelly: Promiscuous (Feat. Timbaland)",1
ABBA: Gimme Gimme Gimme (A Man After Midnight),1
"Twain, Shania: That Don't Impress Me Much",2
"Sinatra, Nancy: These Boots Are Made For Walkin'",8
ABC: Poison Arrow,1
"Bowie, David: Soul Love",1
Anthrax: Bring The Noise (Feat. Public Enemy),2
"Easton, Sheena: Sugar Walls",1
"Kravitz, Lenny: It Ain't Over 'Til It's Over",1
Notorious B.I.G.: Mo' Money Mo' Problems (Feat. Puff Daddy & Mase),1
"McEntire, Reba: Does He Love You (Feat. Linda Davis)",1
Pantera: Cowboys From Hell,1
Beyonce: Irreplaceable,1
Ashanti: Foolish,1
Erasure: Oh L'Amour,1
Muse: Feeling Good,2
Seether: Broken (Feat. Amy Lee),1
AC-DC: Shoot To Thrill,2
Juvenile: Slow Motion,1
Hall & Oates: Out Of Touch,1
"Petty, Tom: Don't Do Me Like That",2
"Strokes, The: Someday",1
Nirvana: Heart Shaped Box,2
T.I.: Big Things Poppin,1
"Stevens, Cat: Another Saturday Night",1
"Human League, The: Don't You Want Me",4
Prince: Do Me Baby,1
"Newton, Juice: Queen Of Hearts",1
"Rolling Stones, The: Shattered",1
"Gibb, Andy: Shadow Dancing",2
Prince: Diamonds And Pearls,2
: Lena_Lovich_-_Lucky_Number_-_SF109-15.ZIP,1
Motley Crue: Without You,1
Prince: Thieves In The Temple,1
"Cars, The: Dangerous Type",1
"Stewart, Rod: This Old Heart Of Mine",1
": Disney - Little Mermaid, The-Under The Sea.zip",1
"Dixon, Alesha: Boy Does Nothing, The",1
: Taylor_Swift_You_Belong_With_Me_50740.zip,1
"Ronstadt, Linda: Love Is A Rose",1
"Perry, Katy: Circle The Drain",2
: Misfits - Attitude - NE.zip,1
"Kinks, The: You Really Got Me",1
"Dekker, Desmond & The Aces: Israelites",1
"Flaming Lips, The: Yoshimi Battles The Pink Robots Part 1",1
Snow Patrol: Run,2
"Beatles, The: Help!",1
Arctic Monkeys: Flourescent Adolescent,1
"Costello, Elvis: Alison",1
Hockey: Too Fake,2
Pulp: Underwear,1
Foster The People: Don't Stop (Color On The Walls),1
Kiss: I Was Made For Loving You,1
"DeBurgh, Chris: Lady In Red, The",1
"Poindexter, Buster: Hot Hot Hot",9
"Benatar, Pat: We Belong To The Night",2
: Wham_Last_Christmas_34862.zip,1
"Everly Brothers, The: Cathy's Clown",1
"McEntire, Reba: Cathy's Clown",1
"Smith, Patti: Because The Night",2
Steely Dan: Deacon Blues,1
"Winehouse, Amy: Rehab",3
"Beatles, The: All My Loving",1
"Lynn, Loretta: Portland, Oregon (Feat. Jack White)",1
"Sinatra, Frank: All Of Me",1
: The_Wiz_Ease_On_Down_The_Road_40065.zip,1
Stone Temple Pilots: Creep,1
"Bonham, Tracy: Mother Mother",2
: Korn - Here To Stay.zip,1
Weezer: Hashpipe,1
"Lewis, Huey: Cruisin' (Feat. Gwyneth Paltrow)",2
"Carpenters, The: Top Of The World",1
"Beatles, The: Can't Buy Me Love",1
"Beatles, The: Day Tripper",1
Audioslave: Set It Off,1
Green Jelly: Three Little Pigs,1
Tool: Lateralus,1
Incubus: I Wish You Were Here,1
Twisted Sister: I Wanna Rock,1
Genesis: I Know What I Like (In Your Wardrobe),1
"Reed, Lou: Satellite Of Love",2
"Zappa, Frank: Broken Hearts Are For Assholes",1
: X-Ray_Spex_-_Germ_Free_Adolescent_-_SF109-03.ZIP,1
"Newton-John, Olivia: Have You Never Been Mellow",1
: Peanuts_Gang_Christmas_Time_Is_Here_92571.zip,1
"Nelson, Willie: On The Road Again",1
Falco: Rock Me Amadeus (German Version),1
Soundgarden: Burden In My Hand,2
Jet: Are You Gonna Be My Girl,2
Broadway-Musicals: Grease 2-Cool Rider,1
: Cee_Lo_Green_F_k_You_85541.zip,1
"Isley Brothers, The: Between The Sheets",3
Modest Mouse: Float On,2
Fugazi: Waiting Room,2
"Village People, The: Y.M.C.A.",2
"Spears, Britney: You Drive Me Crazy",1
"Withers, Bill: Use Me",1
Foo Fighters: Monkey Wrench,1
"Rocky Horror Picture Show: Hot Patootie, Bless My Soul",1
Seal: Fly Like An Eagle,1
Backstreet Boys: I'll Never Break Your Heart,1
Hinder: Lips Of An Angel,1
"Dayne, Taylor: Tell It To My Heart",1
"Michaelson, Ingrid: Way I Am, The",4
"Carpenters, The: Superstar",1
"Muppets, The: Kermit The Frog-Bein' Green",1
Madonna: Beautiful Stranger,1
"Haggard, Merle: I Think I'll Just Stay Here And Drink",1
"Motels, The: Only The Lonely",1
Simon & Garfunkel: Bridge Over Troubled Water,4
Creedence Clearwater Revival: Bad Moon Rising,2
"Groban, Josh: You Raise Me Up",1
: Melanie_Fiona_Give_It_To_Me_Right_50009.zip,1
INXS: Suicide Blonde,1
"Collins, Phil: Don't Lose My Number",1
Usher: Yeah (Feat. Ludacris & Lil Jon),1
"Evans, Sara: Suds In The Bucket",1
Broadway-Musicals: Chicago-And All That Jazz (Film Version),1
Broadway-Musicals: Moulin Rouge-Come What May,1
Shivaree: Goodnight Moon,2
Sugarland: Stuck Like Glue,1
Elastica: Connection,1
"Martin, Dean: Memories Are Made Of This",1
: Marc_Broussard_Home_156926.zip,1
"Temptations, The: I Wish It Would Rain",1
Team America: Freedom Isn't Free,1
"Jackson, Michael: Way You Make Me Feel, The",2
"Lennon, John: Mind Games",1
"Marvelettes, The: Beechwood 45789",1
"Shangri-Las, The: Leader Of The Pack",1
"Blunt, James: Goodbye My Lover",1
"Gold, Andrew: Thank You For Being A Friend",4
: G24772.zip,1
: G25415.zip,1
Pig: Shit for Brains,1
GMCFOSHO: IMDABES,1
Lady Antebellum: Need You Now,2
"Perry, Katy: California Gurls",1
"Great White: Once Bitten, Twice Shy",1
Disturbed: Down With The Sickness,2
