Oingo Boingo: Little Girls,12
Cee-Lo: F--K You,5
"Coulton, Jonathan: Re Your Brains",8
Pearl Jam: Even Flow,5
Four Non Blondes: What's Up,25
Dixie Chicks: Goodbye Earl,1
"Mellencamp, John: Hurts So Good",4
"Michael, George: I Want Your Sex",1
"Morissette, Alanis: You Oughta Know",11
"Fall Out Boy: Sugar, We're Goin' Down",2
Creed: Higher,1
"Blondie: Tide Is High, The",3
"Sisters Of Mercy: Temple Of Love, The",4
Keane: Somewhere Only We Know,2
Deee-Lite: Groove Is In The Heart,3
"Michael, George: Faith",10
"Benatar, Pat: Hit Me With Your Best Shot",23
Kris Kross: Jump,1
"Underwood, Carrie: Before He Cheats",10
"Dion, Celine: My Heart Will Go On",7
"Benatar, Pat: Heartbreaker",11
"Darkness, The: I Believe In A Thing Called Love",19
Ke$ha: Tik Tok,12
Journey: Don't Stop Believin',17
Eve 6: Inside Out,7
Guns 'N' Roses: Sweet Child O' Mine,17
"Black Crowes, The: Hard To Handle",13
House Of Pain: Jump Around,5
C+C Music Factory: Things That Make You Go Hmmm,1
"Redding, Otis: (Sittin' On) The Dock Of The Bay",5
"Nalick, Anna: Breathe (2 A.M.)",1
"Carlton, Vanessa: Thousand Miles, A",3
INXS: Need You Tonight,7
Kriss Kross: Jump,7
: Cee_Lo_Green_F_k_You_85230.wmv,3
"Holmes, Rupert: Escape (The Pina Colada Song)",3
"Cope, Julian: World Shut Your Mouth",1
: Chris_Brown_Look_At_Me_Now_(Instrumental)_105820.mp3,4
"Wonder, Stevie: I Wish",1
"Gaye, Marvin: Ain't No Mountain High Enough (Feat. Tammi Terrell)",2
": Brown, Chris - Look At Me Now (Feat. Busta Rhymes & Lil Wayne).zip",1
"Lauper, Cyndi: Girls Just Wanna Have Fun",6
"Green, Cee-Lo: F--K You",11
Prince: Kiss,6
"Partridge Family, The: I Think I Love You",1
"Divinyls, The: I Touch Myself",13
Foreigner: Urgent,4
Iron Maiden: Run To The Hills,4
Tool: Prison Sex,1
: Taylor_Swift_I_Knew_You_Were_Trouble_155827.zip,1
"Kinks, The: Don't Forget To Dance",1
"Velvet Underground, The: Sweet Jane",1
Tool: Aenima,14
Siouxsie & The Banshees: Hong Kong Garden,1
"Joplin, Janis: Summertime",5
Aerosmith: Dream On,3
Heart: These Dreams,1
"Bowie, David: Changes",3
"Costello, Elvis: Watching The Detectives",2
Foghat: Slow Ride,1
Franz Ferdinand: This Fire,1
"Bowie, David: Cygnet Committee",2
"Bowie, David: Quicksand",3
"Specials, The: Message To You Rudy, A",21
Franz Ferdinand: Take Me Out,3
"Yankovic, Weird Al: Dare To Be Stupid",1
"Bowie, David: Supermen, The",1
"Cars, The: Let's Go",1
"Clash, The: London Calling",3
Faith No More: Easy,8
Mr. Bungle: Pink Cigarette,3
"Houston, Whitney: I Have Nothing",1
"Williams, Deniece: Free",1
Squeeze: Tempted,2
"Diamond, Neil: Sweet Caroline",23
Queen: Crazy Little Thing Called Love,5
"Paper Lace: Night Chicago Died, The",2
Supergrass: Alright,2
"Joel, Billy: Movin' Out (Anthony's Song)",7
Talking Heads: Once In A Lifetime,3
Kings Of Leon: Use Somebody,8
"Black Crowes, The: Jealous Again",1
U2: Angel Of Harlem,1
Oasis: Wonderwall,23
R.E.M: Orange Crush,1
Snow Patrol: Chasing Cars,1
Flight Of The Conchords: Business Time,11
"Everett, Jace: Bad Things (Theme From 'True Blood')",11
"Cohen, Leonard: Everybody Knows",1
Echo & The Bunnymen: Killing Moon (Original Version),4
"Killers, The: All These Things That I've Done",6
Duran Duran: Hungry Like The Wolf,7
"Kravitz, Lenny: Fly Away",3
When In Rome: Promise,11
R.E.M.: Nightswimming,1
"Lennox, Annie: No More I Love You's",1
": Penn, Michael - No Myth - SofKg017-05.zip",1
Madness: Our House,1
Blind Melon: No Rain,7
Cee Lo Green: F--K You,10
"Waits, Tom: Goin' Out West",3
"Collins, Phil: In The Air Tonight",3
"Proclaimers, The: (500 Miles) I'm Gonna Be",12
"Vega, Suzanne: Tom's Diner (Feat. DNA)",1
"Cars, The: Drive",1
Soft Cell: Tainted Love,8
Boomtown Rats: I Don't Like Mondays,2
"Cohen, Leonard: I'm Your Man",1
"Idol, Billy: Rebel Yell",16
"Offspring, The: Self Esteem",12
"Cars, The: Just What I Needed",7
AC-DC: For Those About To Rock (We Salute You),1
Electric Light Orchestra (E.L.O.): Sweet Talkin' Woman,1
MGMT: Electric Feel,10
James: Laid,7
Marcy Playground: Sex And Candy,8
Wheatus: Teenage Dirtbag,5
Muse: Uprising,5
"Sharpe, Edward & The Magnetic Zeros: Home",14
Alabama: I'm In A Hurry And I Don't Know Why,1
"Rocky Horror Picture Show: Science Fiction, Double Feature",2
Dixie Chicks: Sin Wagon,2
Eagles: Hotel California,7
"West, Kanye: Heartless",7
"Valens, Ritchie: La Bamba",2
Montgomery Gentry: Hell Yeah,1
"Sinatra, Frank: That's Life",2
"Darin, Bobby: Mack The Knife",8
"Bennett, Tony: I Left My Heart In San Francisco",5
"Doors, The: Break On Through",4
Van Halen: You Really Got Me,1
"Newton-John, Olivia & John Travolta: Summer Nights",2
Ke$ha: Take It Off,2
A-HA: Take On Me,4
Journey: Any Way You Want It,6
Neon Trees: Animal,5
Chicago: If You Leave Me Now,5
Starland Vocal Band: Afternoon Delight,1
"Michael, George: Careless Whisper",4
"Prince: Beautiful Ones, The",4
"Who, The: Pinball Wizard",3
"Walker Brothers, The: Sun Aint Gonna Shine Anymore, The",1
LaTour: People Are Still Having Sex,1
: Prince - Let's Go Crazy-NEW,1
"Lidell, Jamie: Another Day (The Lala Love Version)",2
Queen: Stone Cold Crazy,4
"DJ Jazzy Jeff & The Fresh Prince: Fresh Prince Of Bel Air, The (Full Version)",2
White Zombie: Thunder Kiss '65,9
Beastie Boys: So Whatcha Want,3
"Flirts, The: Jukebox (Don't Put Another Dime)",2
Squeeze: Cool For Cats,4
Rockwell: Somebody's Watching Me,3
"Bowie, David: Starman",5
"Bowie, David: Heroes",5
"Bowie, David: All The Madmen",2
Depeche Mode: Strangelove,1
Arcade Fire: No Cars Go,3
"Bowie, David: Oh You Pretty Things",5
Snoop Dogg: Sensual Seduction,4
Faith No More: Midlife Crisis,10
Vampire Weekend: A-Punk,4
Styx: Come Sail Away,12
Robyn: With Every Heartbeat (Feat. Kleerup),1
A Perfect Circle: 3 Libras,8
"Rolling Stones, The: (I Can't Get No) Satisfaction",3
"Springsteen, Bruce: I'm On Fire",2
"Cash, Johnny: Flesh And Blood",1
Muse: Can't Take My Eyes Off You,7
"Franklin, Aretha: Respect",3
: Outkast_-_Prototype_-_SF223-11.ZIP,1
Skid Row: 18 And Life,3
: Trio_-_Da_Da_Da_-_SF082-06.ZIP,1
Sneaker Pimps: 6 Underground,5
Talking Heads: Psycho Killer,9
"Joplin, Janis: Piece Of My Heart",11
After The Fire: Der Kommissar,1
"Team America: America, F--K Yeah",3
"Bowie, David: I'm Afraid Of Americans",2
Pink Floyd: Time,3
Monty Python: Bruces Philosophers Song,1
"Greg Kihn Band, The: Jeopardy",2
: Plastic_Bertrand_-_Ca_Plane_Pour_Moi_-_SF109-05.ZIP,1
Anthrax: Got The Time,1
"Lidell, Jamie: Another Day",3
Muse: Resistance,7
Depeche Mode: I Feel You,13
"Wonder, Stevie: Superstition",4
"Smiths, The: How Soon Is Now",5
"Bowie, David: John, I'm Only Dancing",4
"Morrison, Van: Brown Eyed Girl",4
"Jam, The: Going Underground",5
Queens Of The Stone Age: First It Giveth,1
": Bowie, David - Magic Dance.zip",1
Enya: Orinoco Flow (Sail Away),4
: Queen-Bohemian Rhapsody.zip,2
: Hedwig_And_The_Angry_Inch_Wig_In_A_Box_85310.wmv,3
"McDonald, Michael: I Keep Forgettin",2
Oingo Boingo: Flesh & Blood,7
"Cure, The: Mint Car",1
"Dolby, Thomas: She Blinded Me With Science",1
Naked Eyes: Always Something There To Remind Me,5
"Who, The: Baba O'Reilly",2
"Timberlake, Justin: My Love (Feat. T.I.)",3
Muse: I Belong To You-Mon coeur s'ouvre a ta voix,11
"Hedwig & The Angry Inch: Origin Of Love, The",3
: The Nightmare Before Christmas - What's This - 34320.zip,2
"Richie, Lionel: Hello",5
: Paul_Anka_Walking_In_Memphis_92562.zip,1
: The_Black_Keys_Tighten_Up_92729.zip,1
Black Eyed Peas: Meet Me Halfway,5
U2: New Years Day,1
: Dropkick_Murphys_Kiss_Me_I_m_Shitfaced_93515.zip,2
"Bowie, David: Kooks",3
: Hayseed Dixie - I Don't Feel Like Dancing (Scissor Sisters).zip,1
"Stewart, Rod: Do Ya Think I'm Sexy",1
"Loggins, Kenny: Whenever I Call You Friend (Feat. Stevie Nicks)",2
: Superdrag-Sucked_Out.zip,1
Three Dog Night: Mama Told Me (Not To Come),2
Creedence Clearwater Revival: Lookin' Out My Back Door,2
Prince: 7,4
Kraftwerk: Model,2
: Gang Of Four - I Love A Man In Uniform.zip,1
: sigur r+¦s - hopp+¡polla - (BKK).zip,6
Hall & Oates: Kiss On My List,5
: Reel Big Fish - Take On Me (A-Ha).zip,1
"Wayne, Jeff: Eve Of The War",2
"Pink Floyd: Great Gig In The Sky, The",4
King: Love & Pride,1
Tenacious D: Beelzeboss (The Final Showdown),2
Dave Dee Dozy Beaky Mick And Tich: Hold Tight,5
: Vampire Weekend - Cousins.zip,1
"English Beat, The: Mirror In The Bathroom",3
": Echo & The Bunnymen - Cutter, The.zip",2
Green Day: Time Of Your Life,3
: Faithless_-_Insomnia_-_SF081-13.ZIP,1
: Kiss - God Of Thunder.zip,2
Sixpence None The Richer: Kiss Me,2
: LMFAO - Party Rock Anthem (Feat. Lauren Bennett And Goonrock).zip,1
Depeche Mode: Home,1
": Lonely Island, The - Jack Sparrow (Feat. Michael Bolton).zip",1
"Ronson, Mark & The Business Intl.: Bike Song, The",3
"Steve Miller Band, The: Abracadabra",1
Thunder: Dirty Love,1
"Markie, Biz: Just A Friend",6
Vanilla Ice: Ice Ice Baby,9
Disney: Lion King-Hakuna Matata,1
Supergrass: Moving,6
: Front 242 - Headhunter - DJ Fnord.zip,1
Red Hot Chili Peppers: Sir Psycho Sexy,1
EMF: Unbelievable,2
: Gotye - Somebody That I Used To Know (Feat. Kimbra).zip,1
"Doobie Brothers, The: Jesus Is Just Alright",1
: Radiohead - Exit Music (For A Film).zip,2
: Invisible light test.zip,1
"Roxy Music: Strand, The",6
: The Nightmare Before Christmas - This Is Halloween.zip,1
"XX, The: Crystalized",2
Joy Division: She's Lost Control,1
Tones On Tail: Go!,2
: The_Reverend_Horton_Heat_It_s_Martini_Time_123023.zip,2
"Belafonte, Harry: Day-O (The Banana Boat Song)",3
: down in mexico.zip,1
: take a bow.zip,2
"Hendrix, Jimi: Purple Haze",2
"Coasters, The: Down In Mexico",8
Van Halen: Ice Cream Man,1
"Rapture, The: Echoes",5
"Swift, Taylor: Love Story",4
"Murvin, Junior: Police And Thieves",5
: valarie loves me.zip,1
"Beatles, The: With A Little Help From My Friends",1
": Cave, Nick & The Bad Seeds - Up Jumped The Devil.zip",1
"Springsteen, Bruce: Dancing In The Dark",4
Talk Talk: Life's What You Make It,2
R. Kelly: I Believe I Can Fly,4
"Rolling Stones, The: Emotional Rescue",2
: Pink Floyd - In The Flesh.zip,1
LMFAO: Sexy And I Know It,2
"Cyrus, Miley: Party In The USA",4
Scissor Sisters: Invisible Light,4
: Flogging Molly - If I Ever Leave This World Alive.zip,5
: Roxy Music - Ladytron.zip,1
: Gotye - Eyes Wide Open.zip,2
: Usher - Climax.zip,2
"Cash, Johnny: Personal Jesus",3
LCD Soundsystem: North American Scum,2
: Radiohead - Reckoner.zip,1
: AWOLNATION - Sail.zip,1
Usher: Climax,9
: 01.-John-Mellencamp-and-Me'shell-Ndegeocello-Wild-Night-(SFWS041-14).zip,1
"Young, Neil: Down By The River",5
Dire Straits: Money For Nothing,7
"Wonder, Stevie: Don't You Worry 'Bout A Thing",8
Low: Hatchet (Optimimi Version),2
Nine Inch Nails: Capital G,1
Geggy Tah: Whoever You Are,2
"Walker, Junior & The All Stars: Shotgun",2
: imdabes final.zip,2
Doobie Brothers: It Keeps You Running,6
Loggins & Messina: House At Pooh Corner,1
: liar.zip,1
"Wayne, Jeff: Thunder Child (Chris Thompson-From 'War Of The Worlds')",2
Sade: Smooth Operator,3
: fenix.zip,1
: G25741.zip,2
"Broadway-Musicals: Sound Of Music-Lonely Goatherd, The",1
: lovage - anger management.zip,3
: Beastie_Boys_Girls_146199.zip,1
: 16 - Friends of P (Originally Performed By the Rentals).zip,1
Flogging Molly: If I Ever Leave This World Alive,5
Stone Temple Pilots: Big Bang Baby,3
"Bowie, David: Fashion",3
"Cave, Nick & The Bad Seeds: Into My Arms",1
"Redding, Otis: Hard To Handle",1
Dead Or Alive: You Spin Me Round (Like A Record),2
: Lil_Wayne_6_Foot_7_Foot_(Instrumental_with_lead_vocals)_96605.zip,2
Tool: Sober,9
Sigur Rós: Hljómalind,1
LCD Soundsystem: All My Friends,5
Type O Negative: Christian Woman,1
: Johnny Cash-The Man Comes Around.zip,1
Simply Red: Holding Back The Years,3
10cc: Dreadlock Holiday,1
"Nat King Cole: Christmas Song, The",1
: Type O Negative  - Cinammon Girl.zip,1
Chingon: Malaguena Salerosa,5
Styx: Mr. Roboto,8
Pulp: Babies,4
: G27323 - HERE COMES THE KING - SNOOP LION.zip,2
: Kendrick_Lamar_-_Swimming_Pools_(Drank)_(Explicit)_-_G25801.ZIP,2
"Cash, Johnny: Hurt",3
"Young, Neil: My My Hey Hey (Electric)",5
"Avalon, Mickey: My D##k (Feat. Dirt Nasty & Andre Legacy)",3
Pulp: Party Hard,2
Aphrodite's Child: Rain & Tears,2
"Black Keys, The: Lonely Boy",2
U2: All I Want Is You,4
Talking Heads: This Must Be The Place (Naive Melody),4
"Numan, Gary: Are Friends Electric",2
Chromatics: Running Up That Hill,2
Stray Cats: I Won't Stand In Your Way,5
"John, Elton: Captain Fantastic & The Brown Dirt Cowboy",2
Muse: Sunburn,2
Oingo Boingo: Just Another Day,5
"Adams, Bryan: Summer Of '69",12
Santana: Maria Maria,1
Queen: Somebody To Love,3
Pink: Leave Me Alone I'm Lonely,1
Fleetwood Mac: Landslide,4
"Clark, Petula: Downtown",1
"Mamas & The Papas, The: Dream A Little Dream Of Me",2
Concrete Blonde: Joey,6
"Sinatra, Frank: New York, New York",5
"Spears, Britney: Baby One More Time",5
Weezer: Beverly Hills,2
"Jones, Catherine-Zeta: And All That Jazz (From Chicago)",23
"Jackson, Michael: Thriller (Without Vincent Price)",6
Madonna: Papa Don't Preach,3
"Soul, Jimmy: If You Wanna Be Happy",2
"Basil, Toni: Mickey",4
Broadway-Musicals: Caberet-Caberet,1
Sublime: Badfish,7
"Sinatra, Frank-SCR: New York, New York",7
"Righteous Brothers, The: You've Lost That Lovin' Feelin'",12
"Joel, Billy: Piano Man",10
"Martin, Dean: That's Amore",4
"Dio: Last In Line, The",2
Electric Six: Gay Bar,9
Devo: Girl U Want,8
Joy Division: Love Will Tear Us Apart,1
"Cheese, Richard: Stronger",1
Barenaked Ladies: If I Had A Million Dollars,3
"Europe: Final Countdown, The",5
"Cooper, Alice: I'm Eighteen",2
Tenacious D: Double Team,2
Lordi: Hard Rock Hallelujah,1
"Cheese, Richard: Down With The Sickness",3
"Gaye, Marvin: Sexual Healing",4
Toto: Africa,9
"Withers, Bill: Ain't No Sunshine",3
"Bowie, David: Suffragette City",5
Nine Inch Nails: Piggy (Acoustic),4
Simon & Garfunkel: I Am A Rock,2
"Bush, Kate: Hounds Of Love",1
Styx: Lady,5
"American Breed: Bend Me, Shape Me",1
"Presidents Of The United States Of America, The: Kitty",3
Blondie: Rip Her To Shreds,1
Garbage: Only Happy When It Rains,1
"Turtles, The: Happy Together",2
"Harvey, PJ: One Line",6
"Turner, Tina: We Don't Need Another Hero",4
Steppenwolf: Born To Be Wild,1
"Michael, George: One More Try",2
U2: With Or Without You,5
"Simone, Nina: My Baby Just Cares For Me",1
Creedence Clearwater Revival: Have You Ever Seen The Rain,2
Van Halen: Jamie's Cryin',1
T. Rex: Get It On,2
Pink: There You Go,1
"Fox, Samantha: Naughty Girls Need Love Too",1
"Apple, Fiona: Shadow Boxer",1
"McLachlan, Sarah: Angel",1
Korn: A.D.I.D.A.S.,5
Melanie: Brand New Key,2
"Beatles, The: Im Only Sleeping",1
Veruca Salt: Seether,1
"Abdul, Paula: Cold Hearted",1
Depeche Mode: Walking In My Shoes,2
Led Zeppelin: Whole Lotta Love,6
"Cure, The: Boys Don't Cry",7
"Loeb, Lisa: Stay (I Missed You)",5
"Elliott, Missy: Work It",2
Bjork: Bachelorette,4
"Simone, Nina: Ain't Got No-I Got Life",2
Bush: Everything Zen,1
Electric Six: Danger High Voltage,8
This Mortal Coil: Song To A Siren,3
Primal Scream: Movin' On Up,1
Robyn: Whos That Girl,2
"A Perfect Circle: Nurse Who Loved Me, The",2
: bj+¦rk - oceania - (BKK).zip,4
Eurythmics: Who's That Girl,3
"Beatles, The: Helter Skelter",3
"Sundays, The: Here's Where The Story Ends",3
: Roxette - Dangerous.zip,1
Broadway-Musicals: Chitty Chitty Bang Bang-Truly Scrumptious,1
"Hendrix, Jimi: Crosstown Traffic",3
Fleetwood Mac: Little Lies,1
Rufus: Tell Me Something Good (Feat. Chaka Kahn),4
: Stevie B - Because I Love You.zip,1
Standard: Like Someone In Love,1
"Led Zeppelin: Ocean, The",3
Berlin: Take My Breath Away,2
"Green, Al: Let's Stay Together",7
"Jackson, Michael: Will You Be There",1
"Hendrix, Jimi: Foxy Lady",4
Muse: Stockholm Syndrome,1
: Robyn_Hang_With_Me_109578.zip,1
Smashing Pumpkins: Zero,4
Mazzy Star: Fade Into You,1
: Goldfrapp - Alive.zip,1
"Franklin, Aretha: Do Right Woman, Do Right Man",1
"Jett, Joan: Do You Wanna Touch Me Oh Yeah",2
Q Lazarus: Goodbye Horses,3
Bush: Comedown,1
Led Zeppelin: Babe I'm Gonna Leave You,1
Goldfrapp: Lovely Head,2
Hot Hot Heat: Bandages,1
"Animals, The: House Of The Rising Sun, The",2
"Morrison, Van: Into The Mystic",2
"Badu, Erykah: Appletree",2
"Badu, Erykah: Bag Lady",1
": Flaming Lips, The - Yoshimi Battles The Pink Robots Part 1.zip",2
Smashing Pumpkins: Bullet With Butterfly Wings,7
: Them - Gloria.ZIP,1
Broadway-Musicals: Grease-There Are Worst Things I Could Do,1
Portishead: Roads,3
: Lana_Del_Rey_Dark_Paradise_144260.zip,1
": AlunaGeorge - Your Drums, Your Love.zip",1
Goldfrapp: Number 1,4
Nirvana: Sliver,1
Smashing Pumpkins: Muzzle,1
"Royce, Rose: Car Wash",1
Sonny & Cher: I Got You Babe,8
Luscious Jackson: Ladyfingers,1
Salt-N-Pepa: Let's Talk About Sex,1
"Wallflowers, The: Sixth Avenue Heartache",1
AC-DC: T.N.T.,4
Bon Jovi: You Give Love A Bad Name,8
Snoop Dogg: Gin And Juice,5
"Myles, Alannah: Black Velvet",15
Adele: Turning Tables,2
20 Fingers: Short D##k Man,2
: Mary_J_Blige_I_m_Going_Down_37276.zip,1
"Greenbaum, Norman: Spirit In The Sky",3
"Gaye, Marvin: Let's Get It On",3
Tiffany: I Think We're Alone Now,1
"Turner, Tina: Private Dancer",2
"Jones, Norah: Don't Know Why",5
"James, Etta: At Last",2
"Spice Girls, The: Say You'll Be There",5
"Turner, Ike & Tina: Proud Mary",2
"Blige, Mary J.: Real Love",1
"Tyler, Bonnie: Total Eclipse Of The Heart",17
Tenacious D: F##k Her Gently,23
T.I.: Whatever You Like,3
Bon Jovi: Wanted Dead Or Alive,19
"Coulton, Jonathan: Skullcrusher Mountain",5
Temple Of The Dog: Hunger Strike,2
Flight Of The Conchords: Ladies Of The World,3
"Pixies, The: Where Is My Mind",3
"Beatles, The: Eleanor Rigby",2
Pearl Jam: Jeremy,2
Foo Fighters: My Hero,4
Beyonce: Single Ladies (Put A Ring On It),3
"Cure, The: Love Song",7
Pearl Jam: Hunger Strike,1
"Paisley, Brad: Alcohol",2
Styx: Too Much Time On My Hands,1
Tenacious D: Tribute,20
"Joel, Billy: We Didn't Start The Fire",4
"Bowie, David: Under Pressure (Feat. Freddie Mercury)",10
Matchbox 20: Unwell,3
Simple Minds: Don't You (Forget About Me),6
Radiohead: High And Dry,3
"Bowie, David: Space Oddity",5
Everclear: Wonderful,1
"Good Charlotte: Anthem, The",3
My Chemical Romance: I'm Not Ok (I Promise),4
Arcade Fire: Rebellion,2
"Muppets, The: Kermit The Frog-Rainbow Connection",7
Aerosmith: I Don't Want To Miss A Thing,3
All-4-One: I Swear,1
"Cure, The: Just Like Heaven",6
Alphaville: Forever Young,3
"Lynch, Liam: United States Of Whatever",3
"Seger, Bob: Turn The Page",4
"Carey, Mariah: All I Want For Christmas Is You",3
Lady Gaga: Just Dance (Feat. Colby O'Donis),1
Wham!: Careless Whisper,6
"Houston, Whitney: How Will I Know",3
Lady GaGa: Just Dance (Feat. Colby O'Donis),4
Beyonce: Halo,3
Franz Ferdinand: Matinee,6
Monty Python: Every Sperm Is Sacred,3
Blue Oyster Cult: Godzilla,5
"Bowie, David: Lady Grinning Soul",2
Rush: Limelight,1
Carolina Liar: Show Me What I Am Looking For,1
"Petty, Tom: Mary Jane's Last Dance",4
"Springsteen, Bruce: Born To Run",1
"Murray, Anne: Danny's Song",1
"Seger, Bob: Night Moves",1
Blur: Song 2,3
112: Peaches And Cream,1
Mumford & Sons: I Will Wait,2
"B-52's, The: Love Shack",10
Survivor: Eye Of The Tiger,5
T.I.: Let's Get Away,1
: LTD_(Every_Time_I_Turn_Around)_Back_in_Love_Again_88789.zip,1
"Clarkson, Kelly: Since You Been Gone",4
Boyz II Men: I'll Make Love To You,3
Notorious B.I.G.: Juicy,15
"Clarkson, Kelly: My Life Would Suck Without You",2
"Ripperton, Minnie: Lovin' You",1
Red Hot Chili Peppers: Scar Tissue,2
"Crow, Sheryl: All I Wanna Do",1
"Who, The: Who Are You",15
Oingo Boingo: Weird Science,2
Meat Loaf: Rock 'N' Roll Dreams Come True,8
"Bloodhound Gang, The: Bad Touch, The",7
Eagles: Take It Easy,3
": Who, The - Who Are You.zip",1
U2: Where The Streets Have No Name,6
"Church, The: Under The Milky Way",3
"Dream Academy, The: Life In A Northern Town",3
Dropkick Murphys: Kiss Me I'm Shitfaced,3
R. Kelly: Bad Man,1
Schoolhouse Rock: I'm Just A Bill,1
ABC: When Smokey Sings,1
Pet Shop Boys: It's A Sin,2
Oingo Boingo: Stay,7
Queen: I Want It All,1
Nine Inch Nails: Closer,7
"Dropkick Murphys, The: Kiss Me I'm Sh#tfaced",3
"Yankovic, 'Weird' Al: Dare To Be Stupid",7
AWOLNATION: Sail,7
"Soggy Bottom Boys, The: I Am A Man Of Constant Sorrow",5
"Pogues, The: Fairytale Of New York",2
U2: Sunday Bloody Sunday,6
: Peter_Gabriel_-_Games_Without_Frontiers_-_MW865-02.ZIP,1
Soundtracks: TV Themes-Greatest American Hero-Believe It Or Not,1
: Genesis_Home_By_The_Sea_35050.zip,1
Depeche Mode: Strange Love,3
Thompson Twins: Doctor Doctor,1
Sisters Of Mercy: This Corrosion,4
"Pixies, The: Here Comes Your Man",4
"Ting Tings, The: That's Not My Name",4
Velvet Revolver: Fall To Pieces,5
"Presley, Elvis: Can't Help Falling In Love",5
Foreigner: Feels Like The First Time,1
"Allman Brothers, The: Midnight Rider",1
"Velvet Underground, The: I'm Waiting For The Man",3
Wang Chung: Dance Hall Days,2
Heart: Alone,11
"Shand, Remy: Way I Feel, The",1
Flight Of The Conchords: Think About It,3
Backstreet Boys: I Want It That Way,11
Big & Rich: Save A Horse (Ride A Cowboy),6
Muse: Plug In Baby,1
Stone Temple Pilots: Interstate Love Song,7
"Marley, Bob: Redemption Song (Acoustic Version)",2
Pearl Jam: Black,1
: MiguelPussyIsMine.zip,1
Muse: Supermassive Black Hole,3
Muse: Time Is Running Out,7
"Rubberbandits, The: Horse Outside",4
Fall Out Boy: This Ain't A Scene (It's An Arms Race),2
Lady Gaga: Bad Romance,26
Haddaway: What Is Love,2
"James, Rick: Give It To Me Baby",7
Nonpoint: Bullet With A Name,1
Slipknot: Wait And Bleed,1
"White Stripes, The: Icky Thump",3
Snoop Dogg: Lodi Dodi,5
: R. Kelly - Real Talk.zip,1
Hall & Oates: Sara Smile,14
"Collins, Phil: Against All Odds",9
Color Me Badd: I Wanna Sex You Up,6
"Sparro, Sam: Black & Gold",3
: Real Talk_mixdown_ext.zip,1
Master Ace: Born To Roll,3
"Clare, Alex: Too Close",3
Dr. Dre: Natural Born Killaz (Feat. Ice Cube),1
"Brown, Bobby: Don't Be Cruel",3
Childish Gambino: Bonfire,4
Outkast: Prototype,1
R. Kelly: In The Kitchen (gonzo version),2
Miguel: Pussy Is Mine,2
: PussyIsMineFinal.zip,1
"Pendergrass, Teddy: Love T K O",1
": Ocean, Frank - Novacane.zip",2
R. Kelly: I Cant Sleep Baby If I,1
: Trapped in the Closet.zip,1
Def Leppard: Pour Some Sugar On Me,9
"Gill, Johnny: My, My, My",2
Snoop Dogg: That's The Sh#t (Feat. R. Kelly),1
"Travolta, John & Olivia Newton John: Summer Nights",1
"Gaynor, Gloria: I Will Survive",11
Pink: So What,5
"Lonely Island, The: Jack Sparrow (Feat. Michael Bolton)",4
Toadies: Possum Kingdom,7
Alice In Chains: Man In The Box,6
Afroman: Crazy Rap,1
No Doubt: Sunday Morning,4
"Beach Boys, The: Sloop John B.",1
"Jepsen, Carly Rae: Call Me Maybe",8
"Jones, Tom: What's New Pussycat",2
lovage: anger management,1
Cake: I Will Survive,9
Led Zeppelin: Immigrant Song,7
Beastie Boys: Sabotage,2
Judas Priest: Victim Of Changes,6
Pulp: Common People,9
Jefferson Airplane: White Rabbit,10
"Coulton, Jonathan: Mandelbrot Set",1
Hanson: MMM Bop,3
"Aiken, Clay: Invisible",1
Cher: Believe,9
Cher: All Or Nothing,1
"Knight, Gladys & The Pips: I've Got To Use My Imagination",1
"Morrison, Mark: Return Of The Mack",5
"Chapman, Tracy: Give Me One Reason",28
Poison: Every Rose Has Its Thorn,1
"Joplin, Janis: Mercedes Benz",1
"Lee, Peggy: Fever",11
Weezer: Say It Ain't So,11
"Band, The: Weight, The",3
"Disney: Little Mermaid, The-Part Of Your World",15
": Carlisle, Belinda - Mad About You.zip",1
Heart: Barracuda,4
"Carey, Mariah: When You Believe (Feat. Whitney Houston)",1
NSYNC: Bye Bye Bye,4
"Jett, Joan: Bad Reputation",3
Adam Ant: Goody Two Shoes,2
"Queen: Show Must Go On, The",2
"Men Without Hats: Safety Dance, The",5
Scorpions: Rock You Like A Hurricane,3
"Astley, Rick: Never Gonna Give You Up",8
Tenacious D: Wonderboy,8
"Scarbury, Joey: Greatest American Hero ('Believe It Or Not')",2
Barenaked Ladies: One Week-NEW,1
Incubus: Pardon Me (Radio Version),1
Blues Traveler: Hook,1
"Cake: Distance, The",6
Matisyahu: King Without A Crown,1
"Morrison, Van: Moondance",2
Barenaked Ladies: One Week,5
"Cranberries, The: Zombie",10
Bad English: When I See You Smile,1
Toad The Wet Sprocket: All I Want,1
Metallica: Whiskey In The Jar,7
Andrew W. K.: Party Hard,3
"Mraz, Jason: Lucky (Feat. Colbie Caillat)",2
: Tenacious D - Classico - SofKg041-18.zip,1
Muse: Starlight,8
"Wilder, Matthew: Break My Stride",1
"John, Elton: Rocket Man",4
Muse: Map Of The Problematique,1
Scissor Sisters: I Can't Decide,2
"Raitt, Bonnie: Something To Talk About",5
"Stewart, Rod: Stay With Me",1
Steely Dan: Do It Again-NEW,1
Tears For Fears: Shout,4
"Commodores, The: Easy",10
Interpol: Slow Hands,2
M.I.A.: Paper Planes,7
: xtc - dear god - (BKK).zip,6
Queen: You're My Best Friend,1
Seals & Crofts: Summer Breeze,4
"Reed, Lou: Sweet Jane",2
: The_English_Beat_Twist_&_Crawl_128867.zip,1
Night Ranger: Sister Christian,13
"Cult, The: She Sells Sanctuary",1
"Waits, Tom: Clap Hands",6
: Loggins_%26_Messina_-_Danny's_Song_-_SFDT-1326.ZIP,1
: wish.zip,1
"Rolling Stones, The: Sympathy For The Devil",5
"Franklin, Aretha: Until You Come Back To Me (That's What I'm Gonna Do)",1
"Nails, The: 88 Lines About 44 Women",2
Ben Folds Five: One Angry Dwarf And 200 Solemn Faces,3
"Waits, Tom: Jockey Full Of Bourbon",1
"Rolling Stones, The: Doo Doo Doo Doo Doo",1
"Davis Jr., Sammy: Candy Man, The",1
Nirvana: Where Did You Sleep Last Night,1
Beck: Debra,3
": Yorn, Pete - Life On A Chain.zip",1
: g love & special sauce - baby's got sauce - (SOFA).mp3,1
: jane's addiction - three days - (DJF).zip,1
"James, Rick: Super Freak",25
"Carter, Clearence: Strokin'",1
"Carter, Clarence: Strokin'",12
Tonic: If You Could Only See,3
"Jackson, Michael: Dirty Diana",4
Metallica: Unforgiven,3
": Sweat, Keith - Nobody (Feat. Athena Cage).zip",1
Sublime: Wrong Way,3
"Richie, Lionel: All Night Long",2
Metallica: Enter Sandman,4
Stone Temple Pilots: Plush,15
"Jackson, Michael: P.Y.T. (Pretty Young Thing)",1
Gap Band: You Dropped The Bomb On Me,1
: Haddaway_What_Is_Love_49728.zip,1
"McDonald, Michael: I Keep Forgettin' (Every Time You're Near)",8
"Vandross, Luther: Never Too Much",1
Ginuwine: Pony,4
"Ocean, Billy: Caribbean Queen (No More Love On The Run)",1
Digital Underground: Freaks Of The Industry (Duet),1
Soundgarden: Fell On Black Days,2
Boyz II Men: Motownphilly,2
AC-DC: Hell's Bells,1
: Ice_Cube_-_Check_Yo_Self_-_G19990.ZIP,1
